RT Join us for some divinityoriginalsin2,neutral
RT Notre derni re session brainstorming sur DivinityOriginalSin2 est dispo sur la cha ne,neutral
RT On vous livre tous les secrets de DivinityOriginalSin2,neutral
switching to some divinityoriginalsin2 for teh last hour of my stream streaming,neutral
RT Notre derni re session brainstorming sur DivinityOriginalSin2 est dispo sur la cha ne,neutral
Join us for some divinityoriginalsin2,neutral
RT Notre derni re session brainstorming sur DivinityOriginalSin2 est dispo sur la cha ne,neutral
Wanna see my first run on divinityoriginalsin2 I ll be on twitch from 21 45 Streamers,positive
9 Things You Might ve Missed In Divinity Original Sin 2 s Opening Area divinityoriginalsin2,positive
we are costreaming tonight with and with DivinityOriginalSin2 7PM EDT,neutral
RT Notre derni re session brainstorming sur DivinityOriginalSin2 est dispo sur la cha ne,neutral
Notre derni re session brainstorming sur DivinityOriginalSin2 est dispo sur la cha ne,neutral
Divinityoriginalsin2 is perfect god this game is amazing,positive
Starting divinityoriginalsin2 in around an hour Looks fun,positive
Don t worry twitch word Xsplit problem fixed Live on stream in 3 4 short hours I cannot wait pubg fortnite divinityoriginalsin2,positive
Signing off to play some divinityoriginalsin2 ENJOY THE REST OF YOUR EVENINGS NIGHTS DAYS AFTAENOONS DUCKIES,positive
I am so happy that totalwarwarhammer2 and divinityoriginalsin2 are both receiving amazing reviews Loving both so far,positive
RT Happy Friday and I have been spared death and awake shipwrecked on Fort Joy in our 4th DivinityOriginalSin2 BroOp,positive
as a crpg fan a Divinity Original Vin series would mean I could die happy Just saying divinityoriginalsin2,positive
Mate I love Sebille but she s pretty grim divinityoriginalsin2,negative
divinityoriginalsin2 c est surement le plus gros soufflet de 2017 G nial jusqu fin acte 2 apr s Je vais me taire tant c est merdique,neutral
RT Happy Friday and I have been spared death and awake shipwrecked on Fort Joy in our 4th DivinityOriginalSin2 BroOp,positive
Happy Friday and I have been spared death and awake shipwrecked on Fort Joy in our 4th,positive
RT I know everyone is playing this game but I NEED to be playing this game so I AM TOO erox divinityoriginalsin2 https,negative
divinityoriginalsin2 not even half way through act 2 and already thinking of what to do on my second play through,negative
Let s Play Divinity Original Sin 2 The Cowardly Dead Part 17 divinityoriginalsin2,positive
on d marre divinityoriginalsin2 en Sebille Rogue,neutral
this game keeps stabbing and stabbing and stabbing me in the heart divinityoriginalsin2,negative
Well time to disappear and not interact with ppl for 2 days divinityoriginalsin2 gaming screenshot,neutral
Nie spielst du mal einen Titel zum Day One oO Ok hier Cuphead divinityoriginalsin2,positive
divinityoriginalsin2 heute so ab 8 mit dem witzigen h bschen und erotischen marcydarcy,neutral
RT Early Minecraft stream Might play divinityoriginalsin2 or ESO later come hang though Support,positive
Freakin out over DOS2 this Friday amp Rhino are back in DivinityOriginalSin2 multiplayer at,neutral
Freakin out over DOS2 this Friday amp Rhino are back in DivinityOriginalSin2 multiplayer at Twitch,neutral
RT Early Minecraft stream Might play divinityoriginalsin2 or ESO later come hang though Support,positive
Early Minecraft stream Might play divinityoriginalsin2 or ESO later come hang though SupportSmallStreamers,positive
RT Giving Hexels another shot Thought I d recreate a legend among RPG companions The Red Prince divinityoriginalsin2 p,neutral
Giving Hexels another shot Thought I d recreate a legend among RPG companions The Red Prince,neutral
New DivinityOriginalSin2 LiveStream LetsPlay VOD now on YouTube SmallYouTuber SmallStreamer Gaming,positive
Ein herrlich verspieltes Epos DivinityOriginalSin2 im Video Test,neutral
The grim secrets of Fort Joy are laid bare in the dungeons DivinityOriginalSin2,negative
RT Ferdi tries to choose what to gnaw at between amp divinityoriginalsin2 It s unbearable DOS2 oregan,negative
Today in DivinityOriginalSin2 we continue to explore the Fort Joy dungeons but it s not long before we,positive
RT divinityoriginalsin2 stream tonight Kosmites Super excited Come hang out at 6PM EST TeamEmmmmsie TwitchKittens htt,positive
If you ve been waiting for a game that gets what RPGs are supposed to be like check out divinityoriginalsin2,negative
Is it better than NeverWinterNights Let s see DivinityOriginalSin2 Geekend Gaming RPG,positive
My wife has to distract Fox when ever I leave the room Such a sook of a bunny sorry pal I need to stream some,negative
Comme vous me l avez demand je vous ai fait une playlist des Lives sur DivinityOriginalSin2,neutral
divinityoriginalsin2 stream tonight Kosmites Super excited Come hang out at 6PM EST TeamEmmmmsie TwitchKittens,positive
RT Whatcha gonna do when they come for you divinityoriginalsin2,neutral
LIVE We are live with divinityoriginalsin2 Tactician Lone Wolf Will we ascend today,positive
RT Divinity Original Sin II Ep 2 divinityoriginalsin2 letsplay gaming,positive
Divinity Original Sin II Ep 2 divinityoriginalsin2 letsplay gaming,positive
At least I don t need an elusive SNESClassicEdition to play DivinityOriginalSin2,negative
RT fox Tot den Freunden divinityoriginalsin2 letsplay deutsch,neutral
DivinityOriginalSin2 is basically one of the best RPGs you can play right now,positive
RT Time to finally look at Divinity Original Sin 2 Lorerunner divinityoriginalsin2,positive
Okay divinityoriginalsin2 players I know you watch this hashtag gt gt Any fix for the camera being zoomed in to the lower 2 3 of speaker,positive
Oliee donated DivinityOriginalSin2 bless his little cotton buds Live in an hour Half price subs don t forget,negative
v Hope so Otherwise i m just filling time with divinityoriginalsin2,neutral
RT fox Tot den Freunden divinityoriginalsin2 letsplay deutsch,neutral
Time to finally look at Divinity Original Sin 2 Lorerunner divinityoriginalsin2,positive
Tot den Freunden divinityoriginalsin2 letsplay deutsch,neutral
Whatcha gonna do when they come for you divinityoriginalsin2,neutral
RT Ferdi tries to choose what to gnaw at between amp divinityoriginalsin2 It s unbearable DOS2 oregan,negative
As se craftea en DivinityOriginalSin2,neutral
Crafting Overhaul adds new items recipes and crafting mechanics to DivinityOriginalSin2,positive
More divinityoriginalsin2 tonight folks Gonna become that divine,positive
RT Ferdi tries to choose what to gnaw at between amp divinityoriginalsin2 It s unbearable DOS2 oregan,negative
Im Video Epilog spricht J rg ber das besondere R tseldesign von DivinityOriginalSin2,neutral
Im glad you had as much fun making her as i had interacting with her Malady,positive
Yeah I just looked at mine still want to buy divinityoriginalsin2,neutral
RT You want bad ass Malady is the baddest divinityoriginalsin2 is my GOTY Congratulation,negative
9 hours in and I m enjoying the hell out of divinityoriginalsin2 Well done,positive
You want bad ass Malady is the baddest divinityoriginalsin2 is my GOTY Congratulation,negative
RT PUBG ve Fortnite n Battle Royale kap mas DivinityOriginalSin2 steamworlddig2 ve fazlas CoopPlay de,neutral
RT Bu hafta CoopPlay de PUBG ve Fortnite n kap mas DivinityOriginalSin2 steamworlddig2 ve daha neler var,neutral
Ep 4 of our DivinityOriginalSin2 Co Op adventure is up now check it out LetsPlay Gaming DOS2,neutral
Today we meet new friends but more importantly STYLE DivinityOriginalSin2,positive
Apr s Midi M4DGIK divinityoriginalsin2 14h 16h Sur,neutral
RT hikari Steal a giant painting from a dungeon and sell it to the nearest NPC Done DivinityOriginalSin2 DoS2,neutral
RT fox Kindchen wo bist du divinityoriginalsin2 deutsch letsplay,neutral
RT fox Vidme Nadel und Faden DIVINITY ORIGINAL SIN 2 006 vidme divinityoriginalsin2 letsplay deutsch,positive
RT hikari Steal a giant painting from a dungeon and sell it to the nearest NPC Done DivinityOriginalSin2 DoS2,neutral
RT Ferdi tries to choose what to gnaw at between amp divinityoriginalsin2 It s unbearable DOS2 oregan,negative
RT fox Nadeln sind garnicht so schlecht german letsplay divinityoriginalsin2,neutral
RT Here I am talking about why I think DivinityOriginalSin2 is a real special game lt 3 lt 3 lt 3,positive
On vous livre tous les secrets de DivinityOriginalSin2,neutral
Lets Play DOS2 Coop Ep08 Kniles the Flenser DivinityOriginalSin2,neutral
I added a video to a playlist Lets Play DOS2 Coop Ep08 Kniles the Flenser DivinityOriginalSin2,neutral
RT DivinityOriginalSin2 Du contenu additionnel Tout est possible Interview,neutral
DivinityOriginalSin2 Du contenu additionnel Tout est possible Interview,neutral
De retour pour vous jouer un mauvais tour Reprends son temps sur un bon RPG divinityoriginalsin2,neutral
RT Delighted 2b part of the voice cast on this exciting new console game divinityoriginalsin2 Out now Had much fun cre,positive
Tienes claro c mo hacer un buen personaje en DivinityOriginalSin2,neutral
RT Ferdi tries to choose what to gnaw at between amp divinityoriginalsin2 It s unbearable DOS2 oregan,negative
16hrs in and Ky is shaping up to be quite the badass divinityoriginalsin2,neutral
RT I know everyone is playing this game but I NEED to be playing this game so I AM TOO erox divinityoriginalsin2 https,negative
RT I know everyone is playing this game but I NEED to be playing this game so I AM TOO erox divinityoriginalsin2 https,negative
RT I know everyone is playing this game but I NEED to be playing this game so I AM TOO erox divinityoriginalsin2 https,negative
